[
  {
    "schema_version": 1,
    "version": "0.2.1",
    "manifest_sha256": "aaaaaaaaaaaaaaaaaaaaaaaaaaaaaaaaaaaaaaaaaaaaaaaaaaaaaaaaaaaaaaaa",
    "artifact_url": "https://example.invalid/releases/0.2.1/verdictan-aarch64-apple-darwin.tar.gz",
    "artifact_sha256": "bbbbbbbbbbbbbbbbbbbbbbbbbbbbbbbbbbbbbbbbbbbbbbbbbbbbbbbbbbbbbbbb",
    "revoked_versions": []
  }
]
